The Company is subject to complex and changing laws and regulations worldwide, which exposes the Company to potential liabilities, increased costs and other adverse effects on the Company&#8217;s business. 

The Company&#8217;s global operations are subject to complex and changing laws and regulations on subjects including, but not limited to: antitrust; privacy, data security and data localization; consumer protection; advertising, sales, billing and e-commerce; product liability; intellectual property ownership and infringement; digital platforms; Internet, telecommunications, and mobile communications; media, television, film and digital content; availability of third-party software applications and services; labor and employment; anti-corruption; import, export and trade; foreign exchange controls and cash repatriation restrictions; anti&#8211;money laundering; foreign ownership and investment; tax; and environmental, health and safety. 

Compliance with these laws and regulations may be onerous and expensive, increasing the cost of conducting the Company&#8217;s global operations. Changes to laws and regulations can adversely affect the Company&#8217;s business by increasing the Company&#8217;s costs, limiting the Company&#8217;s ability to offer a product or service to customers, requiring changes to the Company&#8217;s supply chain and business practices or otherwise making the Company&#8217;s products and services less attractive to customers. The Company has implemented policies and procedures designed to ensure compliance with applicable laws and regulations, but there can be no assurance that the Company&#8217;s employees, contractors or agents will not violate such laws and regulations or the Company&#8217;s policies and procedures. If the Company is found to have violated laws and regulations, it could materially adversely affect the Company&#8217;s reputation, financial condition and operating results. 

The technology industry, including, in some instances, the Company, is subject to intense media, political and regulatory scrutiny, which exposes the Company to government investigations, legal actions and penalties. For example, the Company is subject to antitrust investigations in various jurisdictions around the world, which can result in legal proceedings and claims against the Company that could, individually or in the aggregate, have a materially adverse impact on the Company&#8217;s financial condition and operating results. In addition, if enacted, legislative and other proposals to further regulate technology companies could result in changes to the Company&#8217;s business, including requiring the Company to modify its product and service offerings, limiting the Company&#8217;s ability to invest in strategic acquisitions, or affecting the Company&#8217;s business relationships with other technology companies, and could have a materially adverse impact on the Company&#8217;s financial condition and operating results. Further, the Company&#8217;s business partners are or may become subject to litigation that, if resolved against them, could affect the Company&#8217;s relationships with these business partners and have a materially adverse impact on the Company&#8217;s financial condition and operating results. There can be no assurance that the Company&#8217;s business will not be materially adversely affected, individually or in the aggregate, by the outcomes of such investigations, litigation or changes to laws and regulations in the future. 

The Company&#8217;s retail stores have required and will continue to require a substantial investment and commitment of resources and are subject to numerous risks and uncertainties. 

The Company&#8217;s retail stores have required substantial investment in equipment and leasehold improvements, information systems, inventory and personnel. The Company also has entered into substantial lease commitments for retail space. Certain stores have been designed and built to serve as high-profile venues to promote brand awareness. Because of their unique design elements, locations and size, these stores require substantially more investment than the Company&#8217;s more typical retail stores. Due to the high cost structure associated with the Company&#8217;s retail stores, a decline in sales or the closure or poor performance of an individual store or multiple stores, including as a result of protective public safety measures in response to the COVID-19 pandemic, could result in significant lease termination costs, write-offs of equipment and leasehold improvements and severance costs. 

The Company&#8217;s retail operations are subject to many factors that pose risks and uncertainties and could adversely impact the Company&#8217;s financial condition and operating results, including macro-economic factors that could have an adverse effect on general retail activity. Other factors include, but are not limited to, the Company&#8217;s ability to: manage costs associated with retail store construction and operation; manage relationships with existing retail partners; manage costs associated with fluctuations in the value of retail inventory; and obtain and renew leases in quality retail locations at a reasonable cost. 

Investment in new business strategies and acquisitions could disrupt the Company&#8217;s ongoing business, present risks not originally contemplated and adversely affect the Company&#8217;s reputation, financial condition and operating results. 

The Company has invested, and in the future may invest, in new business strategies or acquisitions. Such endeavors may involve significant risks and uncertainties, including distraction of management from current operations, greater-than-expected liabilities and expenses, economic, political, legal and regulatory challenges associated with operating in new businesses, regions or countries, inadequate return on capital, potential impairment of tangible and intangible assets, and significant write-offs. These new ventures are inherently risky and may not be successful. The failure of any significant investment could adversely affect the Company&#8217;s reputation, financial condition and operating results. 

Apple Inc. | 2020 Form 10-K | 11 

The Company&#8217;s business and reputation may be impacted by information technology system failures or network disruptions. 

The Company is exposed to information technology system failures or network disruptions caused by natural disasters, accidents, power disruptions, telecommunications failures, acts of terrorism or war, computer viruses, physical or electronic break-ins, or other events or disruptions. System redundancy and other continuity measures may be ineffective or inadequate, and the Company&#8217;s business continuity and disaster recovery planning may not be sufficient for all eventualities. Such failures or disruptions can adversely impact the Company&#8217;s business by, among other things, preventing access to the Company&#8217;s online services, interfering with customer transactions or impeding the manufacturing and shipping of the Company&#8217;s products. These events could materially adversely affect the Company&#8217;s reputation, financial condition and operating results. 

There may be losses or unauthorized access to or releases of confidential information, including personally identifiable information, that could subject the Company to significant reputational, financial, legal and operational consequences. 

The Company&#8217;s business requires it to use and store confidential information including, among other things, personally identifiable information (&#8220;PII&#8221;) with respect to the Company&#8217;s customers and employees. The Company devotes significant resources to network and data security, including through the use of encryption and other security measures intended to protect its systems and data. But these measures cannot provide absolute security, and losses or unauthorized access to or releases of confidential information occur and could materially adversely affect the Company&#8217;s reputation, financial condition and operating results. 

The Company&#8217;s business also requires it to share confidential information with suppliers and other third parties. Although the Company takes steps to secure confidential information that is provided to third parties, such measures are not always effective and losses or unauthorized access to or releases of confidential information occur and could materially adversely affect the Company&#8217;s reputation, financial condition and operating results. 

For example, the Company may experience a security breach impacting the Company&#8217;s information technology systems that compromises the confidentiality, integrity or availability of confidential information. Such an incident could, among other things, impair the Company&#8217;s ability to attract and retain customers for its products and services, impact the Company&#8217;s stock price, materially damage supplier relationships, and expose the Company to litigation or government investigations, which could result in penalties, fines or judgments against the Company. 

Although malicious attacks perpetrated to gain access to confidential information, including PII, affect many companies across various industries, the Company is at a relatively greater risk of being targeted because of its high profile and the value of the confidential information it creates, owns, manages, stores and processes. 

The Company has implemented systems and processes intended to secure its information technology systems and prevent unauthorized access to or loss of sensitive data, including through the use of encryption and authentication technologies. As with all companies, these security measures may not be sufficient for all eventualities and may be vulnerable to hacking, employee error, malfeasance, system error, faulty password management or other irregularities. For example, third parties fraudulently induce employees or customers into disclosing user names, passwords or other sensitive information, which may, in turn, be used to access the Company&#8217;s information technology systems. To help protect customers and the Company, the Company monitors its services and systems for unusual activity and may freeze accounts under suspicious circumstances, which, among other things, may result in the delay or loss of customer orders or impede customer access to the Company&#8217;s products and services. 

In addition to the risks relating to general confidential information described above, the Company is also subject to specific obligations relating to health data and payment card data. Health data is subject to additional privacy, security and breach notification requirements, and the Company can be subject to audit by governmental authorities regarding the Company&#8217;s compliance with these obligations. If the Company fails to adequately comply with these rules and requirements, or if health data is handled in a manner not permitted by law or under the Company&#8217;s agreements with healthcare institutions, the Company could be subject to litigation or government investigations, may be liable for associated investigatory expenses, and could also incur significant fees or fines. 

Under payment card rules and obligations, if cardholder information is potentially compromised, the Company could be liable for associated investigatory expenses and could also incur significant fees or fines if the Company fails to follow payment card industry data security standards. The Company could also experience a significant increase in payment card transaction costs or lose the ability to process payment cards if it fails to follow payment card industry data security standards, which would materially adversely affect the Company&#8217;s reputation, financial condition and operating results. 

While the Company maintains insurance coverage that is intended to address certain aspects of data security risks, such insurance coverage may be insufficient to cover all losses or all types of claims that may arise. 

Apple Inc. | 2020 Form 10-K | 12 

The Company&#8217;s business is subject to a variety of U.S. and international laws, rules, policies and other obligations regarding data protection. 

The Company is subject to federal, state and international laws relating to the collection, use, retention, security and transfer of PII. In many cases, these laws apply not only to third-party transactions, but also may restrict transfers of PII among the Company and its international subsidiaries. Several jurisdictions have passed laws in this area, and other jurisdictions are considering imposing additional restrictions. These laws continue to develop and may be inconsistent from jurisdiction to jurisdiction. Complying with emerging and changing international requirements may cause the Company to incur substantial costs or require the Company to change its business practices. Noncompliance could result in significant penalties or legal liability. 

The Company makes statements about its use and disclosure of PII through its privacy policy, information provided on its website and press statements. Any failure by the Company to comply with these public statements or with other federal, state or international privacy-related or data protection laws and regulations could result in proceedings against the Company by governmental entities or others. In addition to reputational impacts, penalties could include ongoing audit requirements and significant legal liability. 

The Company&#8217;s success depends largely on the continued service and availability of key personnel. 

Much of the Company&#8217;s future success depends on the continued availability and service of key personnel, including its Chief Executive Officer, executive team and other highly skilled employees. Experienced personnel in the technology industry are in high demand and competition for their talents is intense, especially in Silicon Valley, where most of the Company&#8217;s key personnel are located. 

The Company&#8217;s business can be impacted by political events, international trade disputes, war, terrorism, natural disasters, public health issues, industrial accidents and other business interruptions. 

Political events, international trade disputes, war, terrorism, natural disasters, public health issues, industrial accidents and other business interruptions could harm or disrupt international commerce and the global economy, and could have a material adverse effect on the Company and its customers, suppliers, contract manufacturers, logistics providers, distributors, cellular network carriers and other channel partners. 

The Company has a large, global business, and the Company believes that it generally benefits from growth in international trade. International trade disputes can result in tariffs, sanctions, and other measures that restrict international trade and can adversely affect the Company&#8217;s business. For example, tensions between the U.S. and China have led to a series of tariffs being imposed by the U.S. on imports from China mainland, as well as other business restrictions. Tariffs may increase the cost of the Company&#8217;s products and the components and raw materials that go into making them. These increased costs adversely impact the gross margin that the Company earns on its products. Tariffs can also make the Company&#8217;s products more expensive for customers, which could make the Company&#8217;s products less competitive and reduce consumer demand. Countries may also adopt other measures, such as controls on imports or exports of goods, technology or data, that could adversely impact the Company&#8217;s operations and supply chain and limit the Company&#8217;s ability to offer its products and services as designed. These measures can require the Company to take various actions, including change suppliers, restructure business relationships, and stop offering third-party applications on its platforms. Changing the Company&#8217;s operations in accordance with new or changed trade restrictions may be expensive, time-consuming, disruptive to the Company&#8217;s operations and distracting to management. Trade restrictions may be announced with little or no advance notice and the Company may not be able to effectively mitigate all adverse impacts from such measures. Political uncertainty surrounding international trade disputes could also have a negative effect on consumer confidence and spending, which could adversely affect the Company&#8217;s business. 

Many of the Company&#8217;s operations and facilities, as well as critical business operations of the Company&#8217;s suppliers and contract manufacturers, are in locations that are prone to earthquakes and other natural disasters. In addition, such operations and facilities are subject to the risk of interruption by fire, power shortages, nuclear power plant accidents and other industrial accidents, terrorist attacks and other hostile acts, labor disputes, public health issues, including pandemics such as the COVID-19 pandemic, and other events beyond the Company&#8217;s control. Global climate change could result in certain types of natural disasters occurring more frequently or with more intense effects. Such events could make it difficult or impossible for the Company to manufacture and deliver products to its customers, create delays and inefficiencies in the Company&#8217;s supply and manufacturing chain, and result in slowdowns and outages to the Company&#8217;s service offerings. Following an interruption to its business, the Company could require substantial recovery time, experience significant expenditures to resume operations, and lose significant sales. Because the Company relies on single or limited sources for the supply and manufacture of many critical components, a business interruption affecting such sources would exacerbate any negative consequences to the Company. 

Apple Inc. | 2020 Form 10-K | 13 

The Company&#8217;s operations are also subject to the risks of industrial accidents at its suppliers and contract manufacturers. While the Company&#8217;s suppliers are required to maintain safe working environments and operations, an industrial accident could occur and could result in disruption to the Company&#8217;s business and harm to the Company&#8217;s reputation. Major public health issues, including pandemics such as the COVID-19 pandemic, have adversely affected, and could in the future adversely affect, the Company due to their impact on the global economy and demand for consumer products; the imposition of protective public safety measures, such as stringent employee travel restrictions and limitations on freight services and the movement of products between regions; and disruptions in the Company&#8217;s supply chain and sales and distribution channels, resulting in interruptions of the supply of current products and delays in production ramps of new products. 

While the Company maintains insurance coverage for certain types of losses, such insurance coverage may be insufficient to cover all losses that may arise. 

The Company expects its quarterly net sales and operating results to fluctuate. 

The Company&#8217;s profit margins vary across its products, services, geographic segments and distribution channels. For example, the gross margins on the Company&#8217;s products and services vary significantly and can change over time. The Company&#8217;s gross margins are subject to volatility and downward pressure due to a variety of factors, including: continued industry-wide global product pricing pressures and product pricing actions that the Company may take in response to such pressures; increased competition; the Company&#8217;s ability to effectively stimulate demand for certain of its products and services; compressed product life cycles; potential increases in the cost of components, outside manufacturing services, and developing, acquiring and delivering content for the Company&#8217;s services; the Company&#8217;s ability to manage product quality and warranty costs effectively; shifts in the mix of products and services, or in the geographic, currency or channel mix; fluctuations in foreign exchange rates; and the introduction of new products or services, including new products or services with higher cost structures. These and other factors could have a materially adverse impact on the Company&#8217;s financial condition and operating results. 

The Company has historically experienced higher net sales in its first quarter compared to other quarters in its fiscal year due in part to seasonal holiday demand. Additionally, new product and service introductions can significantly impact net sales, cost of sales and operating expenses. Further, the Company generates a significant portion of its net sales from a single product and a decline in demand for that product could significantly impact quarterly net sales. The Company could also be subject to unexpected developments, such as lower-than-anticipated demand for the Company&#8217;s products or services, issues with new product or service introductions, information technology system failures or network disruptions, or failure of one of the Company&#8217;s logistics, components supply, or manufacturing partners. 

The Company&#8217;s stock price is subject to volatility. 

The Company&#8217;s stock price has experienced substantial price volatility in the past and may continue to do so in the future. Additionally, the Company, the technology industry and the stock market as a whole have experienced extreme stock price and volume fluctuations that have affected stock prices in ways that may have been unrelated to these companies&#8217; operating performance. Price volatility over a given period may cause the average price at which the Company repurchases its stock to exceed the stock&#8217;s price at a given point in time. The Company believes its stock price should reflect expectations of future growth and profitability. The Company also believes its stock price should reflect expectations that its cash dividend will continue at current levels or grow, and that its current share repurchase program will be fully consummated. Future dividends are subject to declaration by the Company&#8217;s Board of Directors, and the Company&#8217;s share repurchase program does not obligate it to acquire any specific number of shares. If the Company fails to meet expectations related to future growth, profitability, dividends, share repurchases or other market expectations, its stock price may decline significantly, which could have a material adverse impact on investor confidence and employee retention. 

The Company&#8217;s financial performance is subject to risks associated with changes in the value of the U.S. dollar relative to local currencies. 

The Company&#8217;s primary exposure to movements in foreign currency exchange rates relates to non&#8211;U.S. dollar&#8211;denominated sales, cost of sales and operating expenses worldwide. Gross margins on the Company&#8217;s products in foreign countries and on products that include components obtained from foreign suppliers could be materially adversely affected by foreign currency exchange rate fluctuations. 

The weakening of foreign currencies relative to the U.S. dollar adversely affects the U.S. dollar value of the Company&#8217;s foreign currency&#8211;denominated sales and earnings, and generally leads the Company to raise international pricing, potentially reducing demand for the Company&#8217;s products. In some circumstances, for competitive or other reasons, the Company may decide not to raise international pricing to offset the U.S. dollar&#8217;s strengthening, which would adversely affect the U.S. dollar value of the gross margins the Company earns on foreign currency&#8211;denominated sales. 

Apple Inc. | 2020 Form 10-K | 14 

Conversely, a strengthening of foreign currencies relative to the U.S. dollar, while generally beneficial to the Company&#8217;s foreign currency&#8211;denominated sales and earnings, could cause the Company to reduce international pricing and incur losses on its foreign currency derivative instruments, thereby limiting the benefit. Additionally, strengthening of foreign currencies may increase the Company&#8217;s cost of product components denominated in those currencies, thus adversely affecting gross margins. 

The Company uses derivative instruments, such as foreign currency forward and option contracts, to hedge certain exposures to fluctuations in foreign currency exchange rates. The use of such hedging activities may not be effective to offset any, or more than a portion, of the adverse financial effects of unfavorable movements in foreign exchange rates over the limited time the hedges are in place. 

The Company is exposed to credit risk and fluctuations in the values of its investment portfolio. 

The Company&#8217;s investments can be negatively affected by liquidity, credit deterioration, financial results, market and economic conditions, political risk, sovereign risk, interest rate fluctuations or other factors. As a result, the value and liquidity of the Company&#8217;s cash, cash equivalents, and marketable and non-marketable securities may fluctuate substantially. Therefore, although the Company has not realized any significant losses on its cash, cash equivalents, and marketable and non-marketable securities, future fluctuations in their value could result in significant losses and could have a material adverse impact on the Company&#8217;s financial condition and operating results. 

