Name,Date of 10k Filing,1A,7
AAPL,2022-10-27T18:01:14-04:00," Item 1A. Risk Factors 

The Company&#8217;s business, reputation, results of operations, financial condition and stock price can be affected by a number of factors, whether currently known or unknown, including those described below. When any one or more of these risks materialize from time to time, the Company&#8217;s business, reputation, results of operations, financial condition and stock price can be materially and adversely affected. 

Because of the following factors, as well as other factors affecting the Company&#8217;s results of operations and financial condition, past financial performance should not be considered to be a reliable indicator of future performance, and investors should not use historical trends to anticipate results or trends in future periods. This discussion of risk factors contains forward-looking statements. 

This section should be read in conjunction with Part II, Item 7, &#8220;Management&#8217;s Discussion and Analysis of Financial Condition and Results of Operations&#8221; and the consolidated financial statements and accompanying notes in Part II, Item 8, &#8220;Financial Statements and Supplementary Data&#8221; of this Form 10-K. 

Macroeconomic and Industry Risks 

The Company&#8217;s operations and performance depend significantly on global and regional economic conditions and adverse economic conditions can materially adversely affect the Company&#8217;s business, results of operations and financial condition. 

The Company has international operations with sales outside the U.S. representing a majority of the Company&#8217;s total net sales. In addition, the Company&#8217;s global supply chain is large and complex and a majority of the Company&#8217;s supplier facilities, including manufacturing and assembly sites, are located outside the U.S. As a result, the Company&#8217;s operations and performance depend significantly on global and regional economic conditions. 

Adverse macroeconomic conditions, including inflation, slower growth or recession, new or increased tariffs and other barriers to trade, changes to fiscal and monetary policy, tighter credit, higher interest rates, high unemployment and currency fluctuations can adversely impact consumer confidence and spending and materially adversely affect demand for the Company&#8217;s products and services. In addition, consumer confidence and spending can be materially adversely affected in response to financial market volatility, negative financial news, conditions in the real estate and mortgage markets, declines in income or asset values, energy shortages and cost increases, labor and healthcare costs and other economic factors. 

In addition to an adverse impact on demand for the Company&#8217;s products, uncertainty about, or a decline in, global or regional economic conditions can have a significant impact on the Company&#8217;s suppliers, contract manufacturers, logistics providers, distributors, cellular network carriers and other channel partners. Potential effects include financial instability; inability to obtain credit to finance operations and purchases of the Company&#8217;s products; and insolvency. 

A downturn in the economic environment can also lead to increased credit and collectibility risk on the Company&#8217;s trade receivables; the failure of derivative counterparties and other financial institutions; limitations on the Company&#8217;s ability to issue new debt; reduced liquidity; and declines in the fair value of the Company&#8217;s financial instruments. These and other economic factors can materially adversely affect the Company&#8217;s business, results of operations, financial condition and stock price. 

The Company&#8217;s business, results of operations, financial condition and stock price have been adversely affected and could in the future be materially adversely affected by the COVID-19 pandemic. 

COVID-19 has had, and continues to have, a significant impact around the world, prompting governments and businesses to take unprecedented measures in response. Such measures have included restrictions on travel and business operations, temporary closures of businesses, and quarantine and shelter-in-place orders. The COVID-19 pandemic has at times significantly curtailed global economic activity and caused significant volatility and disruption in global financial markets. 

The COVID-19 pandemic and the measures taken by many countries in response have adversely affected and could in the future materially adversely impact the Company&#8217;s business, results of operations, financial condition and stock price. During the course of the pandemic, certain of the Company&#8217;s component suppliers and manufacturing and logistical service providers have experienced disruptions, resulting in supply shortages that affected sales worldwide, and similar disruptions could occur in the future. Public safety measures can also adversely impact consumer demand for the Company&#8217;s products and services in affected areas. 

Apple Inc. | 2022 Form 10-K | 5 

The Company continues to monitor the situation and take appropriate actions in accordance with the recommendations and requirements of relevant authorities. The extent to which the COVID-19 pandemic may impact the Company&#8217;s operational and financial performance remains uncertain and will depend on many factors outside the Company&#8217;s control, including the timing, extent, trajectory and duration of the pandemic, the emergence of new variants, the development, availability, distribution and effectiveness of vaccines and treatments, the imposition of protective public safety measures, and the impact of the pandemic on the global economy and demand for consumer products and services. Additional future impacts on the Company may include material adverse effects on demand for the Company&#8217;s products and services, the Company&#8217;s supply chain and sales and distribution channels, the Company&#8217;s ability to execute its strategic plans, and the Company&#8217;s profitability and cost structure. 

To the extent the COVID-19 pandemic adversely affects the Company&#8217;s business, results of operations, financial condition and stock price, it may also have the effect of heightening many of the other risks described in this Part I, Item 1A of this Form 10-K. 

The Company&#8217;s business can be impacted by political events, trade and other international disputes, war, terrorism, natural disasters, public health issues, industrial accidents and other business interruptions. 

Political events, trade and other international disputes, war, terrorism, natural disasters, public health issues, industrial accidents and other business interruptions can harm or disrupt international commerce and the global economy, and could have a material adverse effect on the Company and its customers, suppliers, contract manufacturers, logistics providers, distributors, cellular network carriers and other channel partners. 

The Company has a large, global business with sales outside the U.S. representing a majority of the Company&#8217;s total net sales, and the Company believes that it generally benefits from growth in international trade. Substantially all of the Company&#8217;s manufacturing is performed in whole or in part by outsourcing partners located primarily in Asia, including China mainland, India, Japan, South Korea, Taiwan and Vietnam. Trade policies and disputes and other international conflicts can result in tariffs, sanctions and other measures that restrict international trade, and can materially adversely affect the Company&#8217;s business, particularly if these measures occur in regions where the Company derives a significant portion of its revenues and/or has significant supply chain operations. For example, tensions between the U.S. and China have led to a series of tariffs being imposed by the U.S. on imports from China mainland, as well as other business restrictions. Tariffs increase the cost of the Company&#8217;s products and the components and raw materials that go into making them. These increased costs can adversely impact the gross margin that the Company earns on its products. Tariffs can also make the Company&#8217;s products more expensive for customers, which could make the Company&#8217;s products less competitive and reduce consumer demand. Countries may also adopt other measures, such as controls on imports or exports of goods, technology or data, that could adversely impact the Company&#8217;s operations and supply chain and limit the Company&#8217;s ability to offer its products and services as designed. These measures can require the Company to take various actions, including changing suppliers, restructuring business relationships, and ceasing to offer third-party applications on its platforms. Changing the Company&#8217;s operations in accordance with new or changed trade restrictions can be expensive, time-consuming and disruptive to the Company&#8217;s operations. Such restrictions can be announced with little or no advance notice and the Company may not be able to effectively mitigate all adverse impacts from such measures. If disputes and conflicts further escalate in the future, actions by governments in response could be significantly more severe and restrictive and could materially adversely affect the Company&#8217;s business. Political uncertainty surrounding trade and other international disputes could also have a negative effect on consumer confidence and spending, which could adversely affect the Company&#8217;s business. 

Many of the Company&#8217;s operations and facilities, as well as critical business operations of the Company&#8217;s suppliers and contract manufacturers, are in locations that are prone to earthquakes and other natural disasters. In addition, such operations and facilities are subject to the risk of interruption by fire, power shortages, nuclear power plant accidents and other industrial accidents, terrorist attacks and other hostile acts, ransomware and other cybersecurity attacks, labor disputes, public health issues, including pandemics such as the COVID-19 pandemic, and other events beyond the Company&#8217;s control. Global climate change is resulting in certain types of natural disasters occurring more frequently or with more intense effects. Such events can make it difficult or impossible for the Company to manufacture and deliver products to its customers, create delays and inefficiencies in the Company&#8217;s supply and manufacturing chain, and result in slowdowns and outages to the Company&#8217;s service offerings. Following an interruption to its business, the Company can require substantial recovery time, experience significant expenditures to resume operations, and lose significant sales. Because the Company relies on single or limited sources for the supply and manufacture of many critical components, a business interruption affecting such sources would exacerbate any negative consequences to the Company. 

Apple Inc. | 2022 Form 10-K | 6 

The Company&#8217;s operations are also subject to the risks of industrial accidents at its suppliers and contract manufacturers. While the Company&#8217;s suppliers are required to maintain safe working environments and operations, an industrial accident could occur and could result in serious injuries or loss of life, disruption to the Company&#8217;s business, and harm to the Company&#8217;s reputation. Major public health issues, including pandemics such as the COVID-19 pandemic, have adversely affected, and could in the future materially adversely affect, the Company due to their impact on the global economy and demand for consumer products; the imposition of protective public safety measures, such as stringent employee travel restrictions and limitations on freight services and the movement of products between regions; and disruptions in the Company&#8217;s supply chain and sales and distribution channels, resulting in interruptions of the supply of current products and delays in production ramps of new products. 

While the Company maintains insurance coverage for certain types of losses, such insurance coverage may be insufficient to cover all losses that may arise. 

Global markets for the Company&#8217;s products and services are highly competitive and subject to rapid technological change, and the Company may be unable to compete effectively in these markets. 

The Company&#8217;s products and services are offered in highly competitive global markets characterized by aggressive price competition and resulting downward pressure on gross margins, frequent introduction of new products and services, short product life cycles, evolving industry standards, continual improvement in product price and performance characteristics, rapid adoption of technological advancements by competitors, and price sensitivity on the part of consumers and businesses. 

The Company&#8217;s ability to compete successfully depends heavily on ensuring the continuing and timely introduction of innovative new products, services and technologies to the marketplace. The Company designs and develops nearly the entire solution for its products, including the hardware, operating system, numerous software applications and related services. As a result, the Company must make significant investments in R&#38;D. There can be no assurance these investments will achieve expected returns, and the Company may not be able to develop and market new products and services successfully. 

The Company currently holds a significant number of patents, trademarks and copyrights and has registered, and applied to register, additional patents, trademarks and copyrights. In contrast, many of the Company&#8217;s competitors seek to compete primarily through aggressive pricing and very low cost structures, and by imitating the Company&#8217;s products and infringing on its intellectual property. Effective intellectual property protection is not consistently available in every country in which the Company operates. If the Company is unable to continue to develop and sell innovative new products with attractive margins or if competitors infringe on the Company&#8217;s intellectual property, the Company&#8217;s ability to maintain a competitive advantage could be materially adversely affected. 

The Company has a minority market share in the global smartphone, personal computer and tablet markets. The Company faces substantial competition in these markets from companies that have significant technical, marketing, distribution and other resources, as well as established hardware, software and digital content supplier relationships. In addition, some of the Company&#8217;s competitors have broader product lines, lower-priced products and a larger installed base of active devices. Competition has been particularly intense as competitors have aggressively cut prices and lowered product margins. Certain competitors have the resources, experience or cost structures to provide products at little or no profit or even at a loss. Some of the markets in which the Company competes have from time to time experienced little to no growth or contracted overall. 

Additionally, the Company faces significant competition as competitors imitate the Company&#8217;s product features and applications within their products or collaborate to offer solutions that are more competitive than those they currently offer. The Company also expects competition to intensify as competitors imitate the Company&#8217;s approach to providing components seamlessly within their offerings or work collaboratively to offer integrated solutions. 

The Company&#8217;s services also face substantial competition, including from companies that have significant resources and experience and have established service offerings with large customer bases. The Company competes with business models that provide content to users for free. The Company also competes with illegitimate means to obtain third-party digital content and applications. 

The Company&#8217;s business, results of operations and financial condition depend substantially on the Company&#8217;s ability to continually improve its products and services to maintain their functional and design advantages. There can be no assurance the Company will be able to continue to provide products and services that compete effectively. 

Apple Inc. | 2022 Form 10-K | 7 

Business Risks 

To remain competitive and stimulate customer demand, the Company must successfully manage frequent introductions and transitions of products and services. 

Due to the highly volatile and competitive nature of the markets and industries in which the Company competes, the Company must continually introduce new products, services and technologies, enhance existing products and services, effectively stimulate customer demand for new and upgraded products and services, and successfully manage the transition to these new and upgraded products and services. The success of new product and service introductions depends on a number of factors, including timely and successful development, market acceptance, the Company&#8217;s ability to manage the risks associated with production ramp-up issues, the availability of application software for the Company&#8217;s products, the effective management of purchase commitments and inventory levels in line with anticipated product demand, the availability of products in appropriate quantities and at expected costs to meet anticipated demand, and the risk that new products and services may have quality or other defects or deficiencies. There can be no assurance the Company will successfully manage future introductions and transitions of products and services. 

The Company depends on component and product manufacturing and logistical services provided by outsourcing partners, many of which are located outside of the U.S. 

Substantially all of the Company&#8217;s manufacturing is performed in whole or in part by outsourcing partners located primarily in Asia, including China mainland, India, Japan, South Korea, Taiwan and Vietnam, and a significant concentration of this manufacturing is currently performed by a small number of outsourcing partners, often in single locations. Changes or additions to the Company&#8217;s supply chain require considerable time and resources and involve significant risks and uncertainties. The Company has also outsourced much of its transportation and logistics management. While these arrangements can lower operating costs, they also reduce the Company&#8217;s direct control over production and distribution. Such diminished control has from time to time and may in the future have an adverse effect on the quality or quantity of products manufactured or services provided, or adversely affect the Company&#8217;s flexibility to respond to changing conditions. Although arrangements with these partners may contain provisions for product defect expense reimbursement, the Company generally remains responsible to the consumer for warranty and out-of-warranty service in the event of product defects and experiences unanticipated product defect liabilities from time to time. While the Company relies on its partners to adhere to its supplier code of conduct, violations of the supplier code of conduct occur from time to time and can materially adversely affect the Company&#8217;s business, reputation, results of operations and financial condition. 

The Company relies on single-source outsourcing partners in the U.S., Asia and Europe to supply and manufacture many components, and on outsourcing partners primarily located in Asia, for final assembly of substantially all of the Company&#8217;s hardware products. Any failure of these partners to perform can have a negative impact on the Company&#8217;s cost or supply of components or finished goods. In addition, manufacturing or logistics in these locations or transit to final destinations can be disrupted for a variety of reasons, including natural and man-made disasters, information technology system failures, commercial disputes, armed conflict, economic, business, labor, environmental, public health or political issues, or international trade disputes. 

The Company has invested in manufacturing process equipment, much of which is held at certain of its outsourcing partners, and has made prepayments to certain of its suppliers associated with long-term supply agreements. While these arrangements help ensure the supply of components and finished goods, if these outsourcing partners or suppliers experience severe financial problems or other disruptions in their business, such continued supply can be reduced or terminated, and the recoverability of manufacturing process equipment or prepayments can be negatively impacted. 

Future operating results depend upon the Company&#8217;s ability to obtain components in sufficient quantities on commercially reasonable terms. 

Because the Company currently obtains certain components from single or limited sources, the Company is subject to significant supply and pricing risks. Many components, including those that are available from multiple sources, are at times subject to industry-wide shortages and significant commodity pricing fluctuations that can materially adversely affect the Company&#8217;s business, results of operations and financial condition. For example, the global semiconductor industry is experiencing high demand and shortages of supply, which has adversely affected, and could materially adversely affect, the Company&#8217;s ability to obtain sufficient quantities of components and products on commercially reasonable terms or at all. While the Company has entered into agreements for the supply of many components, there can be no assurance the Company will be able to extend or renew these agreements on similar terms, or at all. Component suppliers may suffer from poor financial conditions, which can lead to business failure for the supplier or consolidation within a particular industry, further limiting the Company&#8217;s ability to obtain sufficient quantities of components on commercially reasonable terms or at all. The effects of global or regional economic conditions on the Company&#8217;s suppliers, described in &#8220; The Company&#8217;s operations and performance depend significantly on global and regional economic conditions and adverse economic conditions can materially adversely affect the Company&#8217;s business, results of operations and financial condition, &#8221; above, can also affect the Company&#8217;s ability to obtain components . Therefore, the Company remains subject to significant risks of supply shortages and price increases that can materially adversely affect its business, results of operations and financial condition. 

Apple Inc. | 2022 Form 10-K | 8 

The Company&#8217;s new products often utilize custom components available from only one source. When a component or product uses new technologies, initial capacity constraints may exist until the suppliers&#8217; yields have matured or their manufacturing capacities have increased. The continued availability of these components at acceptable prices, or at all, can be affected for any number of reasons, including if suppliers decide to concentrate on the production of common components instead of components customized to meet the Company&#8217;s requirements. When the Company&#8217;s supply of components for a new or existing product has been delayed or constrained, or when an outsourcing partner has delayed shipments of completed products to the Company, the Company&#8217;s business, results of operations and financial condition have been adversely affected and future delays or constraints could materially adversely affect the Company&#8217;s business, results of operations and financial condition. The Company&#8217;s business and financial performance could also be materially adversely affected depending on the time required to obtain sufficient quantities from the source, or to identify and obtain sufficient quantities from an alternative source. 

The Company&#8217;s products and services may be affected from time to time by design and manufacturing defects that could materially adversely affect the Company&#8217;s business and result in harm to the Company&#8217;s reputation. 

